{
  "schema": "cia-day/v1",
  "day": "2026-09-28",
  "updatedAt": "2026-09-28T23:55:09Z",
  "runs": "111111111111111111111111111111111111111111111111111111111111111111111111111111111111111111111111111111111111111111111111111111111111111111111111111111111111111111111111111111111111111111111111111111111111111111111111111111111111111111111111111111111111111111111111111111111111111111111111",
  "services": {
    "frontend": {
      "availability": "oooooooooooooooooooooooooooooooooooooooooooooooooooooooooooooooooooooooooooooooooooooooooooooooooooooooooooooooooooooooooooooooooooooooooooooooooooooooooooooooooooooooooooooooooooooooooooooooooooooooooooooooooooooooooooooooooooooooooooooooooooooooooooooooooooooooooooooooooooooooooooooooo",
      "integrity": "wwwwwwwwwwwwwwwwwwwwwwwwwwwwwwwwwwwwwwwwwwwwwwwwwwwwwwwwwwwwwwwwwwwwwwwwwwwwwwwwwwwwwwwwwwwwwwwwwwwwwwwwwwwwwwwwwwwwwwwwwwwwwwwwwwwwwwwwwwwwwwwwwwwwwwwwwwwwwwwwwwwwwwwwwwwwwwwwwwwwwwwwwwwwwwwwwwwwwwwwwwwwwwwwwwwwwwwwwwwwwwwwwwwwwwwwwwwwwwwwwwwwwwwwwwwwwwwwwwwwwwwwwwwwwwwwwwwwwwwwwwwwwwww",
      "confidentiality": "oooooooooooooooooooooooooooooooooooooooooooooooooooooooooooooooooooooooooooooooooooooooooooooooooooooooooooooooooooooooooooooooooooooooooooooooooooooooooooooooooooooooooooooooooooooooooooooooooooooooooooooooooooooooooooooooooooooooooooooooooooooooooooooooooooooooooooooooooooooooooooooooo",
      "latency": {
        "p50Ms": 71,
        "p95Ms": 134,
        "samples": 288,
        "slotsMs": [
          142,
          149,
          60,
          60,
          101,
          81,
          65,
          68,
          60,
          65,
          70,
          64,
          93,
          78,
          94,
          83,
          67,
          91,
          96,
          93,
          60,
          61,
          123,
          129,
          63,
          61,
          130,
          87,
          60,
          60,
          115,
          61,
          121,
          62,
          122,
          134,
          84,
          69,
          61,
          114,
          74,
          97,
          123,
          60,
          60,
          60,
          117,
          60,
          94,
          97,
          149,
          65,
          77,
          87,
          61,
          97,
          61,
          93,
          61,
          62,
          134,
          91,
          64,
          66,
          69,
          76,
          67,
          81,
          60,
          60,
          60,
          72,
          146,
          78,
          101,
          111,
          90,
          71,
          149,
          75,
          62,
          67,
          108,
          77,
          138,
          67,
          62,
          68,
          60,
          119,
          60,
          61,
          60,
          142,
          60,
          79,
          86,
          74,
          96,
          107,
          74,
          69,
          68,
          76,
          81,
          71,
          77,
          86,
          60,
          132,
          68,
          92,
          61,
          60,
          61,
          64,
          137,
          60,
          72,
          68,
          77,
          147,
          133,
          73,
          113,
          131,
          65,
          63,
          60,
          131,
          60,
          61,
          62,
          76,
          70,
          60,
          141,
          130,
          60,
          67,
          65,
          115,
          60,
          62,
          67,
          71,
          64,
          61,
          60,
          61,
          61,
          60,
          61,
          64,
          62,
          60,
          61,
          68,
          60,
          60,
          126,
          60,
          147,
          60,
          62,
          60,
          60,
          69,
          84,
          79,
          110,
          61,
          119,
          138,
          126,
          81,
          120,
          116,
          60,
          98,
          71,
          60,
          90,
          60,
          90,
          94,
          130,
          60,
          74,
          73,
          61,
          72,
          60,
          75,
          123,
          127,
          65,
          127,
          96,
          112,
          66,
          68,
          65,
          121,
          74,
          70,
          61,
          88,
          99,
          91,
          63,
          60,
          98,
          106,
          65,
          138,
          102,
          61,
          120,
          60,
          60,
          60,
          102,
          107,
          63,
          79,
          82,
          79,
          60,
          131,
          101,
          129,
          60,
          142,
          60,
          82,
          60,
          67,
          132,
          91,
          72,
          71,
          60,
          70,
          72,
          66,
          71,
          60,
          69,
          60,
          87,
          60,
          60,
          111,
          63,
          75,
          77,
          124,
          72,
          60,
          126,
          60,
          60,
          60,
          111,
          60,
          67,
          62,
          80,
          94,
          84,
          65,
          122,
          111,
          62,
          66,
          82,
          70,
          120,
          67,
          60,
          124,
          88,
          64,
          65,
          60,
          81,
          60
        ]
      }
    },
    "sign": {
      "availability": "oooooooooooooooooooooooooooooooooooooooooooooooooooooooooooooooooooooooooooooooooooooooooooooooooooooooooooooooooooooooooooooooooooooooooooooooooooooooooooooooooooooooooooooooooooooooooooooooooooooooooooooooooooooooooooooooooooooooooooooooooooooooooooooooooooooooooooooooooooooooooooooooo",
      "integrity": "oooooooooooooooooooooooooooooooooooooooooooooooooooooooooooooooooooooooooooooooooooooooooooooooooooooooooooooooooooooooooooooooooooooooooooooooooooooooooooooooooooooooooooooooooooooooooooooooooooooooooooooooooooooooooooooooooooooooooooooooooooooooooooooooooooooooooooooooooooooooooooooooo",
      "confidentiality": "oooooooooooooooooooooooooooooooooooooooooooooooooooooooooooooooooooooooooooooooooooooooooooooooooooooooooooooooooooooooooooooooooooooooooooooooooooooooooooooooooooooooooooooooooooooooooooooooooooooooooooooooooooooooooooooooooooooooooooooooooooooooooooooooooooooooooooooooooooooooooooooooo",
      "latency": {
        "p50Ms": 175,
        "p95Ms": 280,
        "samples": 288,
        "slotsMs": [
          164,
          258,
          164,
          161,
          160,
          164,
          165,
          164,
          210,
          249,
          176,
          179,
          186,
          163,
          229,
          197,
          167,
          161,
          207,
          160,
          175,
          160,
          160,
          287,
          280,
          160,
          250,
          160,
          160,
          160,
          160,
          211,
          201,
          221,
          173,
          196,
          196,
          255,
          161,
          162,
          213,
          202,
          160,
          247,
          175,
          192,
          160,
          162,
          181,
          163,
          201,
          160,
          226,
          160,
          217,
          161,
          213,
          194,
          190,
          160,
          164,
          160,
          189,
          207,
          160,
          162,
          242,
          165,
          181,
          160,
          245,
          191,
          162,
          160,
          262,
          160,
          166,
          160,
          220,
          252,
          168,
          162,
          190,
          161,
          163,
          160,
          167,
          170,
          160,
          160,
          163,
          250,
          188,
          216,
          169,
          258,
          203,
          180,
          160,
          160,
          187,
          196,
          182,
          200,
          162,
          196,
          237,
          160,
          288,
          160,
          165,
          160,
          160,
          223,
          160,
          252,
          269,
          232,
          257,
          287,
          160,
          178,
          204,
          286,
          161,
          193,
          236,
          262,
          275,
          161,
          160,
          214,
          160,
          162,
          160,
          162,
          185,
          287,
          169,
          160,
          162,
          219,
          182,
          225,
          164,
          162,
          217,
          185,
          299,
          160,
          236,
          163,
          169,
          179,
          209,
          162,
          160,
          248,
          166,
          189,
          210,
          160,
          201,
          187,
          167,
          161,
          165,
          160,
          161,
          200,
          173,
          170,
          181,
          160,
          200,
          184,
          203,
          160,
          211,
          160,
          184,
          199,
          166,
          181,
          160,
          193,
          172,
          164,
          160,
          288,
          221,
          165,
          162,
          174,
          262,
          193,
          232,
          168,
          289,
          249,
          165,
          173,
          275,
          160,
          160,
          161,
          246,
          255,
          246,
          164,
          199,
          160,
          203,
          162,
          205,
          189,
          163,
          173,
          175,
          186,
          167,
          162,